{
  "eventType": "sala.ambiente.v1",
  "eventId": "anc-204-A#17",
  "deviceId": "anc-204-A",
  "entityId": "sala-204",
  "eventTimeMs": 18420,
  "sequence": 17,
  "value": 912.4,
  "unit": "ppm",
  "state": "COERENTE",
  "ocupacaoCo2": "OCUPADA",
  "contagemRadio": 28,
  "amostrasInvalidas": 0,
  "bufferizado": false
}
